<?xml version="1.0" ?>
<companies xmlns:xsi="http://www.w3.org/2001/XMLSchema-instance" xsi:noNamespaceSchemaLocation="companies.xsd">
    <company id="1">
        <name>IKEA</name>
        <description>asdfsd ökasdf ökuh</description>
        <location>Rothenburg</location>
        <numberOfEmployees>300</numberOfEmployees>
    </company>
    <company id="2">
        <name>Schnittlauch AG</name>
        <description>TestText</description>
        <location>Lauffeburg</location>
        <numberOfEmployees>283</numberOfEmployees>
    </company>
</companies>